{
  "id": "msg-20260912T093000Z-2b9d",
  "run_id": "20260912-research-cifar10",
  "node_id": "N1",
  "kind": "revision",
  "prompt": "Extend the warmup to 5 epochs; the loss curve looks unstable in the first epoch.",
  "created_at": "2026-09-12T09:30:00Z",
  "status": "acknowledged",
  "updated_at": "2026-09-12T09:38:00Z",
  "work_id": "N1-r-002",
  "result_node_id": null,
  "note": null
}
