{
  "id": "msg-20260912T091000Z-e4a0",
  "run_id": "20260912-research-cifar10",
  "node_id": "N3",
  "kind": "revision",
  "prompt": "Retry squeeze-excite at batch 256.",
  "created_at": "2026-09-12T09:10:00Z",
  "status": "rejected",
  "updated_at": "2026-09-12T09:15:00Z",
  "work_id": null,
  "result_node_id": null,
  "note": "N3 is failed and the OOM is a hardware limit; batch 256 halves throughput below the evaluator budget."
}
