{
  "id": "msg-20260912T095600Z-7c1e",
  "run_id": "20260912-research-cifar10",
  "node_id": "N2",
  "kind": "branch",
  "prompt": "Try the RandAugment policy from the AutoAugment paper as a child of N2.",
  "created_at": "2026-09-12T09:56:00Z",
  "status": "pending",
  "updated_at": "2026-09-12T09:56:00Z",
  "work_id": null,
  "result_node_id": null,
  "note": null
}
